{
  "schema_version": 2,
  "evidence_class": "static_source_single_client_inventory",
  "capability_state": "source_single_client_observe_only_unproven",
  "runtime_state": "not_executed",
  "sources": [
    {"path":"apps/tamandua_agent/build.rs","role":"rust_build_topology","sha256":"d55e6fc281a89e2ba933d062aacbd50e257afb58dec28324979aa1c286c83df4"},
    {"path":"apps/tamandua_agent/SystemExtension/Package.swift","role":"swiftpm_harness","sha256":"ef5a99e1c4c4a1d2dbdf2e18e20a67efa78b580ebf21a9e903cc347399063ba3"},
    {"path":"apps/tamandua_agent/SystemExtension/TamanduaFileMonitor/ESClient.swift","role":"sole_es_client","sha256":"e122f227532d9bb1f1d1942752a08c238c5360a4bbc0773578145c34ce05bdb1"},
    {"path":"apps/tamandua_agent/SystemExtension/TamanduaFileMonitor/TamanduaFileMonitor.swift","role":"sysext_entrypoint","sha256":"fd63ffd4c012884906f7dc8ace9a0a7ff4299a5b011cae8deab6541640b1dcc7"},
    {"path":"apps/tamandua_agent/SystemExtension/TamanduaFileMonitor/XPCServer.swift","role":"read_only_xpc_server","sha256":"b8812fa33bddf0ad4b1dd1408c2a3a1e2207a174a7d80b933bde28f868df9445"},
    {"path":"apps/tamandua_agent/SystemExtension/TamanduaFileMonitor/Info.plist","role":"sysext_info_intent","sha256":"29d6c34c9cee8ccf9f8dcc4c10b5c6af29cb80b1de35fc2cd543f3583539b74e"},
    {"path":"apps/tamandua_agent/SystemExtension/TamanduaFileMonitor/entitlements.plist","role":"sysext_entitlements_intent","sha256":"b7294df000248b8b2081e041832afa16a3fa5fa7727a8391a1275bface1f705f"},
    {"path":"apps/tamandua_agent/SystemExtension/Tests/ESClientTests.swift","role":"swift_es_source_tests","sha256":"63f3e00a8021279a696a773a356f629f6ccf0c7a12b9152ea71f90e9d58e6493"},
    {"path":"apps/tamandua_agent/SystemExtension/Tests/XPCServerTests.swift","role":"swift_xpc_source_tests","sha256":"31aec75ba1083a06cc01e884e8a1da516b29f4e07850c6b5389d61fd94a5205c"},
    {"path":"apps/tamandua_agent/src/collectors/mod.rs","role":"rust_collector_registry","sha256":"7d8aaaa7f6877a24f60a8889683ad8b3c8cedba235af71e168184b7df03001cb"},
    {"path":"apps/tamandua_agent/src/collectors/sysext_bridge.rs","role":"rust_read_only_bridge","sha256":"625427ae23c214dcb79b386e216c756290fe64068b503b4b73dea8b51c722072"},
    {"path":"apps/tamandua_agent/src/collectors/endpoint_security.rs","role":"dormant_direct_es_source","sha256":"96d95313d3cf2d84de59dcb90f77610ba14eee6de5ab764727cdf06595adb93d"},
    {"path":"apps/tamandua_agent/tests/unit/collectors/endpoint_security.rs","role":"direct_es_import_regression","sha256":"6b7bef4e5943c8d05f75eb30407c91c1a194125801cac79a271cbe0abbbfd76b"},
    {"path":"apps/tamandua_agent/src/collectors/macos/capabilities.rs","role":"macos_fail_closed_capabilities","sha256":"51ef78f8d008590aa699ca0905b788cd877573cbd550603eee76837716438b9e"},
    {"path":"apps/tamandua_agent/src/collectors/status.rs","role":"collector_fail_closed_status","sha256":"f3922b176bb19105d7f174cb80aac34e0050c410fc634a78f8e3141cdd72a473"},
    {"path":"apps/tamandua_agent/src/config/mod.rs","role":"collector_compatibility_config","sha256":"f2ad43d3f68374a7bcc9e9fca440866a9bc74d361c9b9a594ffc9c52de31aa33"},
    {"path":"apps/tamandua_agent/src/collectors/health.rs","role":"macos_fail_closed_health","sha256":"19d798d623326776a02eee336dc74b5f21a693cc3abee05870336b9bdbe90372"},
    {"path":"apps/tamandua_agent/tests/macos_endpoint_health_tests.rs","role":"macos_health_status_regression","sha256":"6b2c82ec80f4c8bd06844dbfe205c81efed1faffcd46d6422c5413025bb04337"},
    {"path":"apps/tamandua_gui/src-tauri/Info.plist","role":"host_usage_metadata_intent","sha256":"a829d6b813a036684ddc7a70f707fa2d1ee30e91a57f25b47d1093c82d92e8fd"},
    {"path":"apps/tamandua_gui/src-tauri/tauri.conf.json","role":"host_tauri_bundle_config","sha256":"d9f735f877120e55d8f79e791febaecd2bc2057cf886c3238ac832b1e30fd987"},
    {"path":"apps/tamandua_agent/src/collectors/catalog.rs","role":"catalog_non_operational_maturity","sha256":"552d2202ff0a34b4d6d786668671f19442e6c01a30da82982c403b66c6225696"},
    {"path":"deploy/installers/macos/entitlements.plist","role":"host_entitlements_intent","sha256":"d275d432077dd645887f85bb9d038650029136d931be7ad8b1f9764a67c33873"},
    {"path":"deploy/installers/macos/create-dmg.sh","role":"bundle_topology_verifier","sha256":"322a20cd3073e59a39668b973f8e3df9ca33971e6fcbba3217d7a25a038360b2"},
    {"path":"docs/architecture/adr/ADR-0002-macos-endpoint-security-single-client.md","role":"architecture_decision","sha256":"590fbaad17e8b475f7fbc100985a55edccdf59297f3a29c30ad18bb8f0611b81"}
  ],
  "inventory_digest": "4be6ee5ab7425309ef57e2877df177b1b0225662b8edd5051ea427a7ef258d77",
  "gate_authority": {
    "path": "tools/detection_validation/scripts/anti_cheat_macos_endpoint_security_single_client_source_v2_gate.py",
    "sha256": "2e1630880d8dd9480a23c00699db40085f5c997df53e99690a155adda74d0acb",
    "trust_model": "detached_fixture_test_vcs_review_external_root_cli_not_self_authenticating",
    "cli_autonomously_authenticates": false,
    "coordinated_change_requires_external_review": true
  },
  "topology": {"host_bundle_id":"com.tamandua.edr","sysext_bundle_id":"com.tamandua.agent.sysext.filemonitor","daemon_bundle_id":"com.tamandua.agent","sole_es_client":"system_extension","daemon_transport":"transport_not_implemented"},
  "lifecycle": {"build":false,"sign":false,"notarize":false,"package":false,"install":false,"activate":false,"connect":false,"subscribe":false,"fda":false,"runtime":false,"telemetry":false,"performance_efficacy":false,"update_rollback":false},
  "claims": {"capability_proven":false,"observe_only_proven":false,"product_ready":false,"production_ready":false,"external_claim_allowed":false},
  "blockers": ["xcode_systemextension_target_absent","host_embed_phase_absent","host_activation_api_absent","host_deactivation_api_absent","host_macos_minimum_below_sysext_requirement","swift_compile_not_validated","xpc_api_availability_not_validated","signed_peer_identifier_unobserved","signed_entitlements_unobserved","apple_es_grant_unobserved","provisioning_unobserved","fda_unobserved","sign_not_validated","notarization_gatekeeper_not_validated","install_activate_not_validated","xpc_runtime_not_validated","es_runtime_not_validated","telemetry_not_validated","performance_efficacy_not_validated","update_rollback_not_rehearsed","release_decision_not_approved"]
}
